client_name,report_period,active_users,licensed_users,adoption_score,projects_active,mobile_usage_rate,daily_logs_count,rfi_count,submittals_count,top_feature,lowest_feature,risk_summary,recommendation_1,recommendation_2,recommendation_3
Summit Ridge Constructors,January 2026,182,310,59,18,41,824,116,204,Daily Logs,Submittals,"Field teams are logging consistently, but office review cycles remain uneven across active projects.","Launch superintendent mobile office hours for three priority jobs.","Create a weekly submittal aging review with project managers.","Publish adoption targets by role for the next 30 days."
Summit Ridge Constructors,February 2026,203,310,65,19,46,912,128,236,Daily Logs,Submittals,"Adoption improved after superintendent enablement, but submittal throughput still trails RFI activity.","Pair high-performing superintendents with two lagging project teams.","Create dashboard alerts for overdue submittal responses.","Review license assignments for inactive office users."
Summit Ridge Constructors,March 2026,226,320,71,21,52,1054,142,268,Daily Logs,Submittals,"Mobile usage crossed the halfway mark, while document workflows need tighter ownership.","Add mobile checklist coaching to foreman huddles.","Assign a submittal coordinator for projects over $25M.","Reconcile inactive users before the next renewal cycle."
Summit Ridge Constructors,April 2026,249,330,75,22,58,1198,151,302,RFIs,Submittals,"RFI consistency is strong, but submittals continue to create schedule risk on complex jobs.","Run a two-week submittal response sprint with PM leadership.","Build saved views for overdue submittals and aging RFIs.","Use project launch templates for every new active project."
Summit Ridge Constructors,May 2026,271,340,80,24,63,1326,168,346,RFIs,Submittals,"Adoption is now healthy across field workflows, with remaining risk concentrated in document review habits.","Review submittal bottlenecks in the monthly executive meeting.","Expand mobile coaching to subcontractor-facing teams.","Document best practices from the top three active projects."
Summit Ridge Constructors,June 2026,286,350,82,25,67,1458,176,389,RFIs,Submittals,"Usage is trending positively, but the team needs sustained governance to prevent backsliding after rollout momentum slows.","Set a 90-day adoption governance cadence with executive sponsorship.","Tie submittal response targets to project health reviews.","Create role-based onboarding for new project starts."
